{
  "configuration": {
    "backend": "hip_gfx1100",
    "cache_mode": "off",
    "collector": "real_http_blocking_natural_tool_quality",
    "concurrency": 1,
    "history": "canonical_valid_fixture_transcript",
    "id": "live-quality-broad-6-c1",
    "lane": "auto_tool",
    "model": "Qwen3.6-35B-A3B",
    "performance_claim": false,
    "quality_system_policy": "automatic_selection_without_expected_tool_name_hint",
    "require_complete_workloads": true,
    "tool_choice": "auto",
    "workloads": [
      "repository_scheduler_en",
      "repository_cache_en",
      "general_en_operations",
      "general_en_release",
      "general_ja_operations",
      "mixed_ja_en_release"
    ]
  },
  "coverage": {
    "agents": 12,
    "concurrency": 1,
    "families": [
      "general_en",
      "general_ja",
      "mixed_ja_en",
      "repository"
    ],
    "generated_tokens": 4538,
    "runs": 12,
    "turns": 48,
    "workloads": [
      "general_en_operations",
      "general_en_release",
      "general_ja_operations",
      "mixed_ja_en_release",
      "repository_cache_en",
      "repository_scheduler_en"
    ]
  },
  "created_at": "2026-07-21T19:43:55.172393+00:00",
  "final_ownership": {
    "active_requests": 0,
    "allowed_cache_bytes": 0,
    "cache_resident_bytes": 0,
    "graph_owners": 0,
    "kv_pinned_pages": 0,
    "kv_refcounted_pages": 0,
    "model_active_requests": 0,
    "pending_requests": 0,
    "session_count": 0,
    "stream_producers": 0,
    "workspace_owners": 0
  },
  "hipengine_artifact_provenance": {
    "build_profile": "gfx1100_agentic_auto_tool_quality",
    "collected_at": "2026-07-21T19:43:55.164564+00:00",
    "command": [
      "/home/lhl/hipEngine-main/.venv/bin/python3",
      "scripts/agentic_coding_quality.py",
      "--base-url",
      "http://127.0.0.1:18140/v1",
      "--workloads",
      "benchmarks/prompts/agentic-quality-v2.json",
      "--all-workloads",
      "--model",
      "Qwen3.6-35B-A3B",
      "--model-path",
      "/models/gguf/Qwen3.6-35B-A3B-UD-Q4_K_M.gguf",
      "--backend",
      "hip_gfx1100",
      "--target-arch",
      "gfx1100",
      "--device-name",
      "AMD Radeon Pro W7900",
      "--quant",
      "gguf_q4_k_m",
      "--kv-dtype",
      "bf16",
      "--compiler-version-file",
      "/tmp/agentic-w7900-hipcc-version.txt",
      "--require-clean-provenance",
      "--concurrency",
      "1",
      "--runs",
      "2",
      "--max-tokens",
      "128",
      "--cache-mode",
      "off",
      "--timeout-s",
      "600",
      "--idle-timeout-s",
      "60",
      "--records-json",
      "/tmp/2026-07-22-w7900-agentic-a6-broad-records-v1.json",
      "--json",
      "/tmp/2026-07-22-w7900-agentic-a6-broad-quality-v1.json"
    ],
    "configured_backend": "hip_gfx1100",
    "device_name": "AMD Radeon Pro W7900",
    "dirty": false,
    "environment": {
      "GPU_MAX_HW_QUEUES": null,
      "HIPENGINE_BACKEND": null,
      "HIPENGINE_COMPILER_VERSION_FILE": "/tmp/agentic-w7900-hipcc-version.txt",
      "HIPENGINE_HIP_ARCH": null,
      "HIPENGINE_PREFIX_CACHE": "off",
      "HIPENGINE_QWEN35_NATIVE_SAMPLER": "0",
      "HIP_VISIBLE_DEVICES": "0",
      "ROCR_VISIBLE_DEVICES": "0"
    },
    "git_branch": "main",
    "hipcc_version": "HIP version: 7.2.53211-3d9ef42\nAMD clang version 22.0.0git (/srcdest/rocm-llvm f58b06dce1f9c15707c5f808fd002e18c2accf7e)\nTarget: x86_64-pc-linux-gnu\nThread model: posix\nInstalledDir: /opt/rocm/lib/llvm/bin\n",
    "hipengine_commit": "878d07a9ba8d3cd24cf44bd88d359be7b4921c2e",
    "kind": "hipengine_artifact_provenance",
    "kv_dtype": "bf16",
    "model_fingerprint": {
      "algorithm": "sha256-sampled-v1",
      "exists": true,
      "path_type": "file",
      "sample_offsets": [
        0,
        11331169424,
        22662338848
      ],
      "sampled_bytes": 3145728,
      "size_bytes": 22663387424,
      "value": "936659d614707776d8e6ca1fb8595991159e78361bff2e3a3616aa91564c89fb"
    },
    "model_path": "/models/gguf/Qwen3.6-35B-A3B-UD-Q4_K_M.gguf",
    "model_revision": null,
    "profiler": {
      "reason": "non-performance quality lane",
      "used": false
    },
    "quant": "gguf_q4_k_m",
    "repetitions": 2,
    "repo_root": "/home/lhl/hipEngine-main",
    "resolved_backend": "hip_gfx1100",
    "rocm_version": "HIP version: 7.2.53211-3d9ef42",
    "schema_version": 1,
    "staged_dirty": false,
    "target_arch": "gfx1100",
    "timing_protocol": "real localhost blocking OpenAI chat; response-owned IDs; external result/patch/test oracles; no latency or throughput fields",
    "unstaged_dirty": false,
    "untracked_count": 0,
    "untracked_dirty": false,
    "warmups": 0
  },
  "kind": "hipengine_agentic_coding_quality_benchmark",
  "performance_claim": false,
  "quality": {
    "attempts": 48,
    "correct_tool_rate": 0.375,
    "correct_tools": 18,
    "exact_arguments": 16,
    "exact_arguments_rate": 0.3333333333333333,
    "external_oracle": {
      "attempts": 48,
      "pass_rate": 0.3333333333333333,
      "passes": 16,
      "patch_attempts": 6,
      "patch_success_rate": 0.0,
      "patch_successes": 0,
      "test_attempts": 8,
      "test_success_rate": 1.0,
      "test_successes": 8
    },
    "families": {
      "general_en": {
        "attempts": 16,
        "correct_tool_rate": 0.375,
        "correct_tools": 6,
        "exact_arguments": 6,
        "exact_arguments_rate": 0.375,
        "external_oracle": {
          "attempts": 16,
          "pass_rate": 0.375,
          "passes": 6,
          "patch_attempts": 0,
          "patch_success_rate": 0.0,
          "patch_successes": 0,
          "test_attempts": 2,
          "test_success_rate": 1.0,
          "test_successes": 2
        },
        "outcomes": {
          "content_alongside_tool_call": 2,
          "invalid_tool_call": 6,
          "no_tool_call": 4,
          "passed": 4
        },
        "repair_attempts": 0,
        "success_rate": 0.25,
        "successes": 4,
        "valid_call_rate": 0.375,
        "valid_calls": 6
      },
      "general_ja": {
        "attempts": 8,
        "correct_tool_rate": 0.25,
        "correct_tools": 2,
        "exact_arguments": 0,
        "exact_arguments_rate": 0.0,
        "external_oracle": {
          "attempts": 8,
          "pass_rate": 0.0,
          "passes": 0,
          "patch_attempts": 0,
          "patch_success_rate": 0.0,
          "patch_successes": 0,
          "test_attempts": 0,
          "test_success_rate": 0.0,
          "test_successes": 0
        },
        "outcomes": {
          "invalid_tool_call": 6,
          "wrong_arguments": 2
        },
        "repair_attempts": 0,
        "success_rate": 0.0,
        "successes": 0,
        "valid_call_rate": 0.25,
        "valid_calls": 2
      },
      "mixed_ja_en": {
        "attempts": 8,
        "correct_tool_rate": 0.5,
        "correct_tools": 4,
        "exact_arguments": 4,
        "exact_arguments_rate": 0.5,
        "external_oracle": {
          "attempts": 8,
          "pass_rate": 0.5,
          "passes": 4,
          "patch_attempts": 2,
          "patch_success_rate": 0.0,
          "patch_successes": 0,
          "test_attempts": 2,
          "test_success_rate": 1.0,
          "test_successes": 2
        },
        "outcomes": {
          "invalid_tool_call": 2,
          "no_tool_call": 2,
          "passed": 4
        },
        "repair_attempts": 0,
        "success_rate": 0.5,
        "successes": 4,
        "valid_call_rate": 0.5,
        "valid_calls": 4
      },
      "repository": {
        "attempts": 16,
        "correct_tool_rate": 0.375,
        "correct_tools": 6,
        "exact_arguments": 6,
        "exact_arguments_rate": 0.375,
        "external_oracle": {
          "attempts": 16,
          "pass_rate": 0.375,
          "passes": 6,
          "patch_attempts": 4,
          "patch_success_rate": 0.0,
          "patch_successes": 0,
          "test_attempts": 4,
          "test_success_rate": 1.0,
          "test_successes": 4
        },
        "outcomes": {
          "content_alongside_tool_call": 4,
          "invalid_tool_call": 6,
          "no_tool_call": 4,
          "passed": 2
        },
        "repair_attempts": 0,
        "success_rate": 0.125,
        "successes": 2,
        "valid_call_rate": 0.375,
        "valid_calls": 6
      }
    },
    "outcomes": {
      "content_alongside_tool_call": 6,
      "invalid_tool_call": 20,
      "no_tool_call": 10,
      "passed": 10,
      "wrong_arguments": 2
    },
    "repair_attempts": 0,
    "success_rate": 0.20833333333333334,
    "successes": 10,
    "valid_call_rate": 0.375,
    "valid_calls": 18
  },
  "schema_version": 1,
  "turn_records": [
    {
      "agent_id": "agent-0",
      "finish": {
        "detail_reason": "length",
        "reason": "length"
      },
      "output": {
        "generated_token_ids": [
          248068,
          198,
          760,
          1156,
          6587,
          310,
          23748,
          279,
          4581,
          27867,
          1500,
          421,
          6473,
          264,
          2400,
          14836,
          6951,
          13,
          198,
          40,
          1144,
          310,
          2624,
          364,
          264,
          3050,
          5215,
          303,
          279,
          27867,
          999,
          13,
          198,
          760,
          2420,
          7141,
          513,
          1510,
          851,
          7561,
          1510,
          36940,
          7561,
          1510,
          20377,
          7561,
          1510,
          34420,
          7561,
          1510,
          9974,
          38331,
          7561,
          1510,
          5917,
          31436,
          27653,
          198,
          63,
          36940,
          63,
          369,
          279,
          1379,
          8053,
          5224,
          310,
          2624,
          364,
          1414,
          303,